<?xml version="1.0" standalone="no"?>
<!DOCTYPE colorbar_list SYSTEM "colorbars.dtd">

<colorbar_list xmlns:py="http://codespeak.net/lxml/objectify/pytype">
    <colorbar name="wvtest2">
        <min_val>-80</min_val>
        <max_val>10</max_val>
        <transition>
            <start_color>(.95,.8,1)</start_color>
            <end_color>(.2,0,.4)</end_color>
            <start_val>-80</start_val>
            <end_val>-70</end_val>
        </transition>
        <transition>
            <start_color>(1,0,0)</start_color>
            <end_color>(1,1,0)</end_color>
            <start_val>-70</start_val>
            <end_val>-64</end_val>
        </transition>
        <transition>
            <start_color>(1,1,0)</start_color>
            <end_color>(0,1,0)</end_color>
            <start_val>-64</start_val>
            <end_val>-59</end_val>
        </transition>
        <transition>
            <start_color>(0,1,0)</start_color>
            <end_color>(0,0,.8)</end_color>
            <start_val>-59</start_val>
            <end_val>-55</end_val>
        </transition>
        <transition>
            <start_color>(0,0,.8)</start_color>
            <end_color>(1,1,1)</end_color>
            <start_val>-55</start_val>
            <end_val>-50</end_val>
        </transition>
        <transition>
            <start_color>(1,1,1)</start_color>
            <end_color>(.1,.1,.1)</end_color>
            <start_val>-50</start_val>
            <end_val>-40</end_val>
        </transition>
        <transition>
            <start_color>(.1,.1,.1)</start_color>
            <end_color>(.6,.3,0)</end_color>
            <start_val>-40</start_val>
            <end_val>-32</end_val>
        </transition>
        <transition>
            <start_color>(.6,.3,0)</start_color>
            <end_color>(1,.5,0)</end_color>
            <start_val>-32</start_val>
            <end_val>-29</end_val>
        </transition>
        <transition>
            <start_color>(1,.5,0)</start_color>
            <end_color>(.3,.3,0)</end_color>
            <start_val>-29</start_val>
            <end_val>-20</end_val>
        </transition>
        <transition>
            <start_color>(.3,.3,0)</start_color>
            <end_color>(.9,.9,0)</end_color>
            <start_val>-20</start_val>
            <end_val>-12</end_val>
        </transition>
        <transition>
            <start_color>(.9,.9,0)</start_color>
            <end_color>(.5,.3,.5)</end_color>
            <start_val>-12</start_val>
            <end_val>-8</end_val>
        </transition>
        <transition>
            <start_color>(.5,.3,.5)</start_color>
            <end_color>(1,.3,.3)</end_color>
            <start_val>-8</start_val>
            <end_val>0</end_val>
        </transition>
        <transition>
            <start_color>(1,.3,.3)</start_color>
            <end_color>(.3,.1,.1)</end_color>
            <start_val>0</start_val>
            <end_val>10</end_val>
        </transition>
    </colorbar> 
</colorbar_list>
